{
  "schemaVersion": 2,
  "journeyId": "JRN-DEMO-CHILE",
  "productType": "Personalised Journey",
  "demo": true,
  "travellerName": "Sample Traveller",
  "destination": "Chile",
  "tripTitle": "Chile, Seen Differently",
  "subtitle": "Santiago and Valparaíso",
  "startDate": "2026-10-12",
  "endDate": "2026-10-16",
  "timezone": "America/Santiago",
  "currency": "CLP",
  "intro": "A slower five-day route combining neighbourhood walks, independent food, local design and coastal viewpoints, with practical alternatives when plans need to change.",
  "routeOverview": "Begin with connected Santiago neighbourhoods, travel to the coast after the morning rush, then explore Valparaíso hillside by hillside. Fixed transfers anchor the route; cultural, food and viewpoint stops remain flexible around energy and conditions.",
  "accommodation": {
    "Santiago": "Lastarria area · demonstration accommodation",
    "Valparaíso": "Cerro Alegre area · demonstration accommodation",
    "Check-in": "From 15:00",
    "Check-out": "By 11:00"
  },
  "bookings": [
    { "label": "Santiago stay", "reference": "LV-DEMO-101", "note": "Check-in 12 October" },
    { "label": "Intercity bus", "reference": "LV-DEMO-204", "note": "Santiago to Valparaíso · confirm terminal" },
    { "label": "Valparaíso stay", "reference": "LV-DEMO-305", "note": "Check-in 14 October" }
  ],
  "preparationChecklist": [
    { "id": "prep-insurance", "label": "Confirm travel insurance and entry requirements" },
    { "id": "prep-bookings", "label": "Download accommodation and transport confirmations" },
    { "id": "prep-maps", "label": "Download offline Google Maps areas" },
    { "id": "prep-places", "label": "Recheck fixed bookings and time-sensitive places" },
    { "id": "prep-companion", "label": "Open every companion section once while online" }
  ],
  "packingChecklist": [
    { "id": "pack-layers", "label": "Layers for changing coastal weather" },
    { "id": "pack-shoes", "label": "Comfortable shoes with grip for steep streets" },
    { "id": "pack-bottle", "label": "Reusable water bottle" },
    { "id": "pack-adapter", "label": "Chile-compatible power adapter" },
    { "id": "pack-daybag", "label": "Secure lightweight day bag" }
  ],
  "budget": [
    { "label": "Accommodation", "amount": 420000 },
    { "label": "Transport", "amount": 85000 },
    { "label": "Food and drink", "amount": 190000 },
    { "label": "Activities", "amount": 65000 },
    { "label": "Flexible buffer", "amount": 70000 }
  ],
  "days": [
    {
      "id": "day-1",
      "date": "2026-10-12",
      "location": "Santiago",
      "theme": "Arrival and neighbourhood orientation",
      "summary": "Settle in, understand the immediate area and begin with an unhurried evening.",
      "routeLogic": "Stay close to Lastarria after arrival. Both activities are walkable from the demonstration accommodation, avoiding another cross-city transfer.",
      "activities": [
        {
          "id": "a1", "placeId": "pla-arrival", "time": "15:00", "title": "Arrival and neighbourhood orientation", "category": "practical", "type": "task",
          "description": "Check in, confirm tomorrow’s transport options and take a short orientation walk around your accommodation area.",
          "duration": "60–90 min", "travelTime": "Start at accommodation", "cost": "Free", "address": "Barrio Lastarria, Santiago", "latitude": -33.4388, "longitude": -70.6402,
          "practicalNote": "Keep the first afternoon deliberately light after travel.", "verification": "Demo — verify before use"
        },
        {
          "id": "a2", "placeId": "pla-lastarria", "time": "18:30", "title": "Lastarria evening walk", "category": "culture", "type": "suggested",
          "description": "Explore a compact cultural district at a gentle pace, noting galleries, bookshops and places to return to later.",
          "duration": "2 hours", "travelTime": "5–10 min walk", "cost": "Flexible", "address": "Barrio Lastarria, Santiago", "latitude": -33.4388, "longitude": -70.6402,
          "practicalNote": "Finish on a well-lit route close to the accommodation.", "alternative": "If arrival is delayed, shorten this to one block around Plaza Mulato Gil.", "verification": "Demo — verify before use"
        }
      ]
    },
    {
      "id": "day-2",
      "date": "2026-10-13",
      "location": "Santiago",
      "theme": "Markets, design and city viewpoints",
      "summary": "A full day grouped by neighbourhood to reduce unnecessary travel.",
      "routeLogic": "Move gradually north and east through central Santiago, leaving the viewpoint until late afternoon for softer light and avoiding backtracking.",
      "activities": [
        {
          "id": "a3", "placeId": "pla-market", "time": "09:00", "title": "Independent breakfast and market context", "category": "food", "type": "food",
          "description": "Begin with a locally owned café, then walk through a nearby market area to understand everyday food culture rather than treating the market as a checklist stop.",
          "duration": "2 hours", "travelTime": "15 min metro plus walk", "cost": "Approx. CLP 14,000", "address": "Central Santiago", "latitude": -33.4372, "longitude": -70.6506,
          "practicalNote": "Choose a verified venue from the approved place list.", "verification": "Demo — verify venue and hours"
        },
        {
          "id": "a4", "placeId": "pla-museum", "time": "12:00", "title": "Museum or design-space choice", "category": "culture", "type": "optional",
          "description": "Choose one focused cultural visit according to your energy and interests. Keep the other as a weather-proof alternative.",
          "duration": "2–3 hours", "travelTime": "10–15 min walk", "cost": "Check current admission", "address": "Santiago, Chile", "latitude": -33.4445, "longitude": -70.6542,
          "practicalNote": "Typical opening patterns only—confirm on the official website.", "alternative": "Use Centro Cultural La Moneda as the rainy-day substitution.", "verification": "Demo — confirm current exhibition"
        },
        {
          "id": "a5", "placeId": "pla-san-cristobal", "time": "17:00", "title": "Late-afternoon city viewpoint", "category": "viewpoint", "type": "suggested",
          "description": "Reach a viewpoint before the evening rush, allowing time for changing light rather than a rushed photo stop.",
          "duration": "90 min", "travelTime": "25 min metro and walk", "cost": "Free or low cost", "address": "Cerro San Cristóbal, Santiago", "latitude": -33.4254, "longitude": -70.6329,
          "practicalNote": "Check access, weather and descent options before setting out.", "alternative": "Use Cerro Santa Lucía for a shorter, more central viewpoint.", "verification": "Demo — confirm access conditions"
        }
      ]
    },
    {
      "id": "day-3",
      "date": "2026-10-14",
      "location": "Valparaíso",
      "theme": "Travel to the coast and explore by hillside",
      "summary": "Travel in the morning and organise the afternoon around one connected hillside area.",
      "routeLogic": "Use the confirmed intercity transfer, leave luggage, then keep the afternoon entirely within Cerro Alegre and Concepción.",
      "activities": [
        {
          "id": "a6", "placeId": "pla-bus", "time": "09:00", "title": "Transfer to Valparaíso", "category": "transport", "type": "fixed",
          "description": "Use the confirmed intercity connection and keep the booking reference available offline. Allow extra time between arrival and the first planned activity.",
          "duration": "Approx. 2 hours plus transfers", "travelTime": "Fixed intercity connection", "cost": "Confirm ticket", "address": "Valparaíso, Chile", "latitude": -33.0472, "longitude": -71.6127,
          "practicalNote": "Confirm the Santiago departure terminal and Valparaíso arrival point.", "verification": "Demo — confirm operator and timetable"
        },
        {
          "id": "a7", "placeId": "pla-cerros", "time": "14:00", "title": "Cerro Alegre and Concepción walking route", "category": "culture", "type": "suggested",
          "description": "Follow a connected route through hillside streets, small galleries and viewpoints. Avoid trying to cover every mural or funicular in one afternoon.",
          "duration": "3 hours", "travelTime": "Start near accommodation", "cost": "Free; allow for refreshments", "address": "Cerro Alegre, Valparaíso", "latitude": -33.0417, "longitude": -71.6276,
          "practicalNote": "Steep streets and uneven surfaces; use funiculars or taxis where appropriate.", "alternative": "Shorten the route around Paseo Yugoslavo if energy or weather changes.", "verification": "Demo — review route and local conditions"
        },
        {
          "id": "a8", "placeId": "pla-dinner", "time": "19:00", "title": "Small-plate dinner near your return route", "category": "food", "type": "food",
          "description": "Choose a verified independent restaurant close to the route back to your accommodation, rather than crossing the city again at night.",
          "duration": "90 min", "travelTime": "Under 15 min walk", "cost": "Approx. CLP 25,000", "address": "Cerro Alegre, Valparaíso", "latitude": -33.043, "longitude": -71.627,
          "practicalNote": "Reserve where required and confirm the safest return route.", "verification": "Demo — select and verify venue"
        }
      ]
    },
    {
      "id": "day-4",
      "date": "2026-10-15",
      "location": "Valparaíso",
      "theme": "Port history and a flexible creative afternoon",
      "summary": "Combine one contextual morning visit with a choice-led afternoon.",
      "routeLogic": "Start lower in the port district, then return uphill once. The afternoon choice remains near the accommodation and adapts to weather and energy.",
      "activities": [
        {